### ISSUE TITLE
Log flooded with "dns_get_record(): A temporary server error occurred"

### ISSUE THREAD

**Issue by nickvergessen** [nextcloud/server#34205]
```json
{
  "reqId": "LP2ucI4M8WYxaHQ9AfD7",
  "level": 3,
  "time": "2022-09-23T04:07:01+00:00",
  "remoteAddr": "…",
  "user": "…",
  "app": "PHP",
  "method": "POST",
  "url": "/ocs/v2.php/references/extract",
  "message": "dns_get_record(): A temporary server error occurred. at /var/www/cloud.nextcloud.com/nextcloud/lib/private/Http/Client/DnsPinMiddleware.php#83",
  "userAgent": "Mozilla/5.0 (X11; Linux x86_64; rv:91.0) Gecko/20100101 Firefox/91.0",
  "version": "25.0.0.13",
  "exception": {
    "Exception": "Error",
    "Message": "dns_get_record(): A temporary server error occurred. at /var/www/cloud.nextcloud.com/nextcloud/lib/private/Http/Client/DnsPinMiddleware.php#83",
    "Code": 0,
    "Trace": [
      {
        "function": "onError",
        "class": "OC\\Log\\ErrorHandler",
        "type": "::",
        "args": [
          2,
          "dns_get_record(): A temporary server error occurred.",
          "/var/www/cloud.nextcloud.com/nextcloud/lib/private/Http/Client/DnsPinMiddleware.php",
          83
        ]
      },
      {
        "file": "/var/www/cloud.nextcloud.com/nextcloud/lib/private/Http/Client/DnsPinMiddleware.php",
        "line": 83,
        "function": "dns_get_record",
        "args": [
          "…",
          16
        ]
      },
      {
        "file": "/var/www/cloud.nextcloud.com/nextcloud/lib/private/Http/Client/DnsPinMiddleware.php",
        "line": 128,
        "function": "dnsResolve",
        "class": "OC\\Http\\Client\\DnsPinMiddleware",
        "type": "->",
        "args": [
          "…",
          1
        ]
      },
      {
        "file": "/var/www/cloud.nextcloud.com/nextcloud/apps/collectives/vendor/guzzlehttp/guzzle/src/PrepareBodyMiddleware.php",
        "line": 35,
        "function": "OC\\Http\\Client\\{closure}",
        "class": "OC\\Http\\Client\\DnsPinMiddleware",
        "type": "->",
        "args": [
          "*** sensitive parameters replaced ***"
        ]
      },
      {
        "file": "/var/www/cloud.nextcloud.com/nextcloud/apps/collectives/vendor/guzzlehttp/guzzle/src/Middleware.php",
        "line": 31,
        "function": "__invoke",
        "class": "GuzzleHttp\\PrepareBodyMiddleware",
        "type": "->",
        "args": [
          "*** sensitive parameters replaced ***",
          "*** sensitive parameters replaced ***"
        ]
      },
      {
        "file": "/var/www/cloud.nextcloud.com/nextcloud/apps/collectives/vendor/guzzlehttp/guzzle/src/RedirectMiddleware.php",
        "line": 71,
        "function": "GuzzleHttp\\{closure}",
        "class": "GuzzleHttp\\Middleware",
        "type": "::",
        "args": [
          "*** sensitive parameters replaced ***"
        ]
      },
      {
        "file": "/var/www/cloud.nextcloud.com/nextcloud/apps/collectives/vendor/guzzlehttp/guzzle/src/Middleware.php",
        "line": 63,
        "function": "__invoke",
        "class": "GuzzleHttp\\RedirectMiddleware",
        "type": "->",
        "args": [
          "*** sensitive parameters replaced ***",
          "*** sensitive parameters replaced ***"
        ]
      },
      {
        "file": "/var/www/cloud.nextcloud.com/nextcloud/apps/collectives/vendor/guzzlehttp/guzzle/src/HandlerStack.php",
        "line": 75,
        "function": "GuzzleHttp\\{closure}",
        "class": "GuzzleHttp\\Middleware",
        "type": "::",
        "args": [
          "*** sensitive parameters replaced ***"
        ]
      },
      {
        "file": "/var/www/cloud.nextcloud.com/nextcloud/apps/collectives/vendor/guzzlehttp/guzzle/src/Client.php",
        "line": 331,
        "function": "__invoke",
        "class": "GuzzleHttp\\HandlerStack",
        "type": "->",
        "args": [
          "*** sensitive parameters replaced ***",
          "*** sensitive parameters replaced ***"
        ]
      },
      {
        "file": "/var/www/cloud.nextcloud.com/nextcloud/apps/collectives/vendor/guzzlehttp/guzzle/src/Client.php",
        "line": 168,
        "function": "transfer",
        "class": "GuzzleHttp\\Client",
        "type": "->",
        "args": [
          "*** sensitive parameters replaced ***",
          "*** sensitive parameters replaced ***"
        ]
      },
      {
        "file": "/var/www/cloud.nextcloud.com/nextcloud/apps/collectives/vendor/guzzlehttp/guzzle/src/Client.php",
        "line": 187,
        "function": "requestAsync",
        "class": "GuzzleHttp\\Client",
        "type": "->",
        "args": [
          "get",
          {
            "__class__": "GuzzleHttp\\Psr7\\Uri"
          },
          [
            "/var/www/data/files_external/rootcerts.crt",
            10,
            [
              {
                "__class__": "Closure"
              }
            ],
            [
              false
            ],
            true,
            "And 6 more entries, set log level to debug to see all entries"
          ]
        ]
      },
      {
        "file": "/var/www/cloud.nextcloud.com/nextcloud/lib/private/Http/Client/Client.php",
        "line": 218,
        "function": "request",
        "class": "GuzzleHttp\\Client",
        "type": "->",
        "args": [
          "get",
          "…",
          [
            "/var/www/data/files_external/rootcerts.crt",
            10,
            [
              {
                "__class__": "Closure"
              }
            ],
            [
              false
            ],
            [
              "Nextcloud Server Crawler",
              "gzip"
            ],
            "And 1 more entries, set log level to debug to see all entries"
          ]
        ]
      },
      {
        "file": "/var/www/cloud.nextcloud.com/nextcloud/lib/private/Collaboration/Reference/LinkReferenceProvider.php",
        "line": 107,
        "function": "get",
        "class": "OC\\Http\\Client\\Client",
        "type": "->",
        "args": [
          "…",
          [
            10
          ]
        ]
      },
      {
        "file": "/var/www/cloud.nextcloud.com/nextcloud/lib/private/Collaboration/Reference/LinkReferenceProvider.php",
        "line": 86,
        "function": "fetchReference",
        "class": "OC\\Collaboration\\Reference\\LinkReferenceProvider",
        "type": "->",
        "args": [
          {
            "__class__": "OC\\Collaboration\\Reference\\Reference"
          }
        ]
      },
      {
        "file": "/var/www/cloud.nextcloud.com/nextcloud/lib/private/Collaboration/Reference/ReferenceManager.php",
        "line": 99,
        "function": "resolveReference",
        "class": "OC\\Collaboration\\Reference\\LinkReferenceProvider",
        "type": "->",
        "args": [
          "…"
        ]
      },
      {
        "file": "/var/www/cloud.nextcloud.com/nextcloud/core/Controller/ReferenceApiController.php",
        "line": 52,
        "function": "resolveReference",
        "class": "OC\\Collaboration\\Reference\\ReferenceManager",
        "type": "->",
        "args": [
          "…"
        ]
      },
      {
        "file": "/var/www/cloud.nextcloud.com/nextcloud/lib/private/AppFramework/Http/Dispatcher.php",
        "line": 225,
        "function": "extract",
        "class": "OC\\Core\\Controller\\ReferenceApiController",
        "type": "->",
        "args": [
          "…",
          true,
          1
        ]
      },
      {
        "file": "/var/www/cloud.nextcloud.com/nextcloud/lib/private/AppFramework/Http/Dispatcher.php",
        "line": 133,
        "function": "executeController",
        "class": "OC\\AppFramework\\Http\\Dispatcher",
        "type": "->",
        "args": [
          {
            "__class__": "OC\\Core\\Controller\\ReferenceApiController"
          },
          "extract"
        ]
      },
      {
        "file": "/var/www/cloud.nextcloud.com/nextcloud/lib/private/AppFramework/App.php",
        "line": 172,
        "function": "dispatch",
        "class": "OC\\AppFramework\\Http\\Dispatcher",
        "type": "->",
        "args": [
          {
            "__class__": "OC\\Core\\Controller\\ReferenceApiController"
          },
          "extract"
        ]
      },
      {
        "file": "/var/www/cloud.nextcloud.com/nextcloud/lib/private/Route/Router.php",
        "line": 298,
        "function": "main",
        "class": "OC\\AppFramework\\App",
        "type": "::",
        "args": [
          "OC\\Core\\Controller\\ReferenceApiController",
          "extract",
          {
            "__class__": "OC\\AppFramework\\DependencyInjection\\DIContainer"
          },
          [
            "ocs.core.ReferenceApi.extract"
          ]
        ]
      },
      {
        "file": "/var/www/cloud.nextcloud.com/nextcloud/ocs/v1.php",
        "line": 62,
        "function": "match",
        "class": "OC\\Route\\Router",
        "type": "->",
        "args": [
          "/ocsapp/references/extract"
        ]
      },
      {
        "file": "/var/www/cloud.nextcloud.com/nextcloud/ocs/v2.php",
        "line": 23,
        "args": [
          "/var/www/cloud.nextcloud.com/nextcloud/ocs/v1.php"
        ],
        "function": "require_once"
      }
    ],
    "File": "/var/www/cloud.nextcloud.com/nextcloud/lib/private/Log/ErrorHandler.php",
    "Line": 92,
    "CustomMessage": "--"
  },
  "id": "632d345f730a4"
}
```

**Comment by come-nc** [comment]
Same as https://github.com/nextcloud/server/issues/28105 ?

**Comment by Entmatix** [comment]
Same error here for latest stable docker image.

```
Error | PHP | Error: dns_get_record(): A temporary server error occurred. at /var/www/html/lib/private/Http/Client/DnsPinMiddleware.php#83<<closure>>OC\Log\ErrorHandler::onError(2, "dns_get_rec ... .", "/var/www/ht ... p", 83)/var/www/html/lib/private/Http/Client/DnsPinMiddleware.php - line 83: dns_get_record("www.edri.org", 16)/var/www/html/lib/private/Http/Client/DnsPinMiddleware.php - line 128: OC\Http\Client\DnsPinMiddleware->dnsResolve("www.edri.org", 1)/var/www/html/3rdparty/guzzlehttp/guzzle/src/PrepareBodyMiddleware.php - line 35: OC\Http\Client\DnsPinMiddleware->OC\Http\Client\{closure}("*** sensiti ... *")/var/www/html/3rdparty/guzzlehttp/guzzle/src/Middleware.php - line 31: GuzzleHttp\PrepareBodyMiddleware->__invoke("*** sensiti ... *", "*** sensiti ... *")/var/www/html/3rdparty/guzzlehttp/guzzle/src/RedirectMiddleware.php - line 71: GuzzleHttp\Middleware::GuzzleHttp\{closure}("*** sensiti ... *")/var/www/html/3rdparty/guzzlehttp/guzzle/src/Middleware.php - line 63: GuzzleHttp\RedirectMiddleware->__invoke("*** sensiti ... *", "*** sensiti ... *")/var/www/html/3rdparty/guzzlehttp/guzzle/src/HandlerStack.php - line 75: GuzzleHttp\Middleware::GuzzleHttp\{closure}("*** sensiti ... *")/var/www/html/3rdparty/guzzlehttp/guzzle/src/Client.php - line 331: GuzzleHttp\HandlerStack->__invoke("*** sensiti ... *", "*** sensiti ... *")/var/www/html/3rdparty/guzzlehttp/guzzle/src/Client.php - line 168: GuzzleHttp\Client->transfer("*** sensiti ... *", "*** sensiti ... *")/var/www/html/3rdparty/guzzlehttp/guzzle/src/Client.php - line 187: GuzzleHttp\Client->requestAsync("get", GuzzleHttp\Psr7\Uri {}, [ "/var/www/ ... "])/var/www/html/lib/private/Http/Client/Client.php - line 218: GuzzleHttp\Client->request("get", "http://www.edri.org/", [ "/var/www/ ... "])/var/www/html/apps/settings/lib/Controller/CheckSetupController.php - line 211: OC\Http\Client\Client->get("http://www.edri.org/")/var/www/html/apps/settings/lib/Controller/CheckSetupController.php - line 193: OCA\Settings\Controller\CheckSetupController->isSiteReachable("www.edri.org")/var/www/html/apps/settings/lib/Controller/CheckSetupController.php - line 860: OCA\Settings\Controller\CheckSetupController->hasInternetConnectivityProblems()/var/www/html/lib/private/AppFramework/Http/Dispatcher.php - line 225: OCA\Settings\Controller\CheckSetupController->check()/var/www/html/lib/private/AppFramework/Http/Dispatcher.php - line 133: OC\AppFramework\Http\Dispatcher->executeController(OCA\Settings ... {}, "check")/var/www/html/lib/private/AppFramework/App.php - line 172: OC\AppFramework\Http\Dispatcher->dispatch(OCA\Settings ... {}, "check")/var/www/html/lib/private/Route/Router.php - line 298: OC\AppFramework\App::main("OCA\\Settin ... r", "check", OC\AppFramew ... {}, [ "settings.CheckSetup.check"])/var/www/html/lib/base.php - line 1030: OC\Route\Router->match("/settings/ajax/checksetup")/var/www/html/index.php - line 36: OC::handleRequest()
-- | -- | --
```

No updates, no apps, no connection to any external resources.

**Comment by szaimen** [comment]
Is this still happening?

**Comment by nickvergessen** [comment]
> Is this still happening?

362 entries in the last 8 days

**Comment by PVince81** [comment]
as far as I understand this is when the Guzzle  http client library connects to an external server, could be a federated share but also the update notification or the internet connection check ?

**Comment by nickvergessen** [comment]
It's the reference link previews of talk, text and others

**Comment by Daryes** [comment]
Still happening as of Nextcloud 25.0.4
For the record, it seems the url the Guzzle http client is trying to use is malformed, I got those links in the log: 
```
            {
               "file": "/server/websites/nextcloud/releases/nextcloud-25.0.4/lib/private/Updater/VersionCheck.php",
                "line": 92,
                "function": "getUrlContent",
                "class": "OC\\Updater\\VersionCheck",
                "type": "->",
                "args": [
                    "https://updates.nextcloud.com/updater_server/?version=25x0x4x1x1353265794.0941x1677326957xstablexx2023-02-23T10:32:31+00:00 0c86714144f50a66e845e9ef80d4cd7e6918a4f5x8x0x21"
                ]
            },
```
That's an example from the logs I had.

Another one, with the full message of another error when trying to reach github.com (as it seems).
Given the server is not air-gapped and is able to reach github without trouble, to me it seems the "dns_get_record" is wrongly used for a different problem (ex : malformed url, or wrong target)

```
{
    "reqId": "pUpkyeKEc02zF5nXB5tz",
    "level": 3,
    "time": "2023-02-25T12:00:35+00:00",
    "remoteAddr": "",
    "user": "--",
    "app": "PHP",
    "method": "",
    "url": "--",
    "message": "dns_get_record(): A temporary server error occurred. at /server/websites/nextcloud/releases/nextcloud-25.0.4/lib/private/Http/Client/DnsPinMiddleware.php#83",
    "userAgent": "--",
    "version": "25.0.3.2",
    "exception": {
        "Exception": "Error",
        "Message": "dns_get_record(): A temporary server error occurred. at /server/websites/nextcloud/releases/nextcloud-25.0.4/lib/private/Http/Client/DnsPinMiddleware.php#83",
        "Code": 0,
        "Trace": [
            {
                "function": "onError",
                "class": "OC\\Log\\ErrorHandler",
                "type": "::",
                "args": [
                    2,
                    "dns_get_record(): A temporary server error occurred.",
                    "/server/websites/nextcloud/releases/nextcloud-25.0.4/lib/private/Http/Client/DnsPinMiddleware.php",
                    83
                ]
            },
            {
                "file": "/server/websites/nextcloud/releases/nextcloud-25.0.4/lib/private/Http/Client/DnsPinMiddleware.php",
                "line": 83,
                "function": "dns_get_record",
                "args": [
                    "github.com",
                    134217728
                ]
            },
            {
                "file": "/server/websites/nextcloud/releases/nextcloud-25.0.4/lib/private/Http/Client/DnsPinMiddleware.php",
                "line": 128,
                "function": "dnsResolve",
                "class": "OC\\Http\\Client\\DnsPinMiddleware",
                "type": "->",
                "args": [
                    "github.com",
                    1
                ]
            },
            {
                "file": "/server/websites/nextcloud/releases/nextcloud-25.0.4/3rdparty/guzzlehttp/guzzle/src/PrepareBodyMiddleware.php",
                "line": 35,
                "function": "OC\\Http\\Client\\{closure}",
                "class": "OC\\Http\\Client\\DnsPinMiddleware",
                "type": "->",
                "args": [
                    "*** sensitive parameters replaced ***"
                ]
            },
            {
                "file": "/server/websites/nextcloud/releases/nextcloud-25.0.4/3rdparty/guzzlehttp/guzzle/src/Middleware.php",
                "line": 31,
                "function": "__invoke",
                "class": "GuzzleHttp\\PrepareBodyMiddleware",
                "type": "->",
                "args": [
                    "*** sensitive parameters replaced ***",
                    "*** sensitive parameters replaced ***"
                ]
            },
            {
                "file": "/server/websites/nextcloud/releases/nextcloud-25.0.4/3rdparty/guzzlehttp/guzzle/src/RedirectMiddleware.php",
                "line": 71,
                "function": "GuzzleHttp\\{closure}",
                "class": "GuzzleHttp\\Middleware",
                "type": "::",
                "args": [
                    "*** sensitive parameters replaced ***"
                ]
            },
            {
                "file": "/server/websites/nextcloud/releases/nextcloud-25.0.4/3rdparty/guzzlehttp/guzzle/src/Middleware.php",
                "line": 63,
                "function": "__invoke",
                "class": "GuzzleHttp\\RedirectMiddleware",
                "type": "->",
                "args": [
                    "*** sensitive parameters replaced ***",
                    "*** sensitive parameters replaced ***"
                ]
            },
            {
                "file": "/server/websites/nextcloud/releases/nextcloud-25.0.4/3rdparty/guzzlehttp/guzzle/src/HandlerStack.php",
                "line": 75,
                "function": "GuzzleHttp\\{closure}",
                "class": "GuzzleHttp\\Middleware",
                "type": "::",
                "args": [
                    "*** sensitive parameters replaced ***"
                ]
            },
            {
                "file": "/server/websites/nextcloud/releases/nextcloud-25.0.4/3rdparty/guzzlehttp/guzzle/src/Client.php",
                "line": 331,
                "function": "__invoke",
                "class": "GuzzleHttp\\HandlerStack",
                "type": "->",
                "args": [
                    "*** sensitive parameters replaced ***",
                    "*** sensitive parameters replaced ***"
                ]
            },
            {
                "file": "/server/websites/nextcloud/releases/nextcloud-25.0.4/3rdparty/guzzlehttp/guzzle/src/Client.php",
                "line": 168,
                "function": "transfer",
                "class": "GuzzleHttp\\Client",
                "type": "->",
                "args": [
                    "*** sensitive parameters replaced ***",
                    "*** sensitive parameters replaced ***"
                ]
            },
            {
                "file": "/server/websites/nextcloud/releases/nextcloud-25.0.4/3rdparty/guzzlehttp/guzzle/src/Client.php",
                "line": 187,
                "function": "requestAsync",
                "class": "GuzzleHttp\\Client",
                "type": "->",
                "args": [
                    "get",
                    [
                        "GuzzleHttp\\Psr7\\Uri"
                    ],
                    [
                        "/server/websites/nextcloud/data/files_external/rootcerts.crt",
                        0,
                        [
                            [
                                "Closure"
                            ]
                        ],
                        "/tmp/oc_tmp_2mc6c7-.tar.gz",
                        [
                            false
                        ],
                        true,
                        [
                            "GuzzleHttp\\HandlerStack"
                        ],
                        true,
                        true,
                        false,
                        false,
                        [
                            "GuzzleHttp/7"
                        ]
                    ]
                ]
            },
            {
                "file": "/server/websites/nextcloud/releases/nextcloud-25.0.4/lib/private/Http/Client/Client.php",
                "line": 218,
                "function": "request",
                "class": "GuzzleHttp\\Client",
                "type": "->",
                "args": [
                    "get",
                    "https://github.com/nextcloud-releases/announcementcenter/releases/download/v6.5.0/announcementcenter-v6.5.0.tar.gz",
                    [
                        "/server/websites/nextcloud/data/files_external/rootcerts.crt",
                        0,
                        [
                            [
                                "Closure"
                            ]
                        ],
                        "/tmp/oc_tmp_2mc6c7-.tar.gz",
                        [
                            false
                        ],
                        [
                            "Nextcloud Server Crawler",
                            "gzip"
                        ],
                        true
                    ]
                ]
            },
            {
                "file": "/server/websites/nextcloud/releases/nextcloud-25.0.4/lib/private/Installer.php",
                "line": 295,
                "function": "get",
                "class": "OC\\Http\\Client\\Client",
                "type": "->",
                "args": [
                    "https://github.com/nextcloud-releases/announcementcenter/releases/download/v6.5.0/announcementcenter-v6.5.0.tar.gz",
                    [
                        "/tmp/oc_tmp_2mc6c7-.tar.gz",
                        0
                    ]
                ]
            },
            {
                "file": "/server/websites/nextcloud/releases/nextcloud-25.0.4/lib/private/Installer.php",
                "line": 193,
                "function": "downloadApp",
                "class": "OC\\Installer",
                "type": "->",
                "args": [
                    "*** sensitive parameters replaced ***",
                    false
                ]
            },
            {
                "file": "/server/websites/nextcloud/releases/nextcloud-25.0.4/lib/private/Updater.php",
                "line": 423,
                "function": "updateAppstoreApp",
                "class": "OC\\Installer",
                "type": "->",
                "args": [
                    "*** sensitive parameters replaced ***"
                ]
            },
            {
                "file": "/server/websites/nextcloud/releases/nextcloud-25.0.4/lib/private/Updater.php",
                "line": 282,
                "function": "upgradeAppStoreApps",
                "class": "OC\\Updater",
                "type": "->",
                "args": [
                    [
                        "admin_audit",
                        "*** sensitive parameters replaced ***",
                        "bookmarks",
                        "bruteforcesettings",
                        "calendar",
                        "checksum",
                        "circles",
                        "cloud_federation_api",
                        "comments",
                        "contacts",
                        "contactsinteraction",
                        "dav",
                        "external",
                        "federatedfilesharing",
                        "files",
                        "files_external",
                        "files_pdfviewer",
                        "files_rightclick",
                        "files_sharing",
                        "files_texteditor",
                        "files_trashbin",
                        "forms",
                        "keeweb",
                        "logreader",
                        "lookup_server_connector",
                        "notes",
                        "notifications",
                        "notify_push",
                        "oauth2",
                        "oidc_login",
                        "password_policy",
                        "photos",
                        "polls",
                        "privacy",
                        "provisioning_api",
                        "recommendations",
                        "related_resources",
                        "serverinfo",
                        "settings",
                        "sharebymail",
                        "side_menu",
                        "support",
                        "systemtags",
                        "tasks",
                        "text",
                        "theming",
                        "twofactor_backupcodes",
                        "updatenotification",
                        "user_ldap",
                        "user_status",
                        "viewer",
                        "weather_status",
                        "workflowengine"
                    ]
                ]
            },
            {
                "file": "/server/websites/nextcloud/releases/nextcloud-25.0.4/lib/private/Updater.php",
                "line": 141,
                "function": "doUpgrade",
                "class": "OC\\Updater",
                "type": "->",
                "args": [
                    "25.0.4.1",
                    "25.0.3.2"
                ]
            },
            {
                "file": "/server/websites/nextcloud/releases/nextcloud-25.0.4/core/Command/Upgrade.php",
                "line": 225,
                "function": "upgrade",
                "class": "OC\\Updater",
                "type": "->",
                "args": []
            },
            {
                "file": "/server/websites/nextcloud/releases/nextcloud-25.0.4/3rdparty/symfony/console/Command/Command.php",
                "line": 255,
                "function": "execute",
                "class": "OC\\Core\\Command\\Upgrade",
                "type": "->",
                "args": [
                    [
                        "Symfony\\Component\\Console\\Input\\ArgvInput"
                    ],
                    [
                        "Symfony\\Component\\Console\\Output\\ConsoleOutput"
                    ]
                ]
            },
            {
                "file": "/server/websites/nextcloud/releases/nextcloud-25.0.4/3rdparty/symfony/console/Application.php",
                "line": 1009,
                "function": "run",
                "class": "Symfony\\Component\\Console\\Command\\Command",
                "type": "->",
                "args": [
                    [
                        "Symfony\\Component\\Console\\Input\\ArgvInput"
                    ],
                    [
                        "Symfony\\Component\\Console\\Output\\ConsoleOutput"
                    ]
                ]
            },
            {
                "file": "/server/websites/nextcloud/releases/nextcloud-25.0.4/3rdparty/symfony/console/Application.php",
                "line": 273,
                "function": "doRunCommand",
                "class": "Symfony\\Component\\Console\\Application",
                "type": "->",
                "args": [
                    [
                        "OC\\Core\\Command\\Upgrade"
                    ],
                    [
                        "Symfony\\Component\\Console\\Input\\ArgvInput"
                    ],
                    [
                        "Symfony\\Component\\Console\\Output\\ConsoleOutput"
                    ]
                ]
            },
            {
                "file": "/server/websites/nextcloud/releases/nextcloud-25.0.4/3rdparty/symfony/console/Application.php",
                "line": 149,
                "function": "doRun",
                "class": "Symfony\\Component\\Console\\Application",
                "type": "->",
                "args": [
                    [
                        "Symfony\\Component\\Console\\Input\\ArgvInput"
                    ],
                    [
                        "Symfony\\Component\\Console\\Output\\ConsoleOutput"
                    ]
                ]
            },
            {
                "file": "/server/websites/nextcloud/releases/nextcloud-25.0.4/lib/private/Console/Application.php",
                "line": 213,
                "function": "run",
                "class": "Symfony\\Component\\Console\\Application",
                "type": "->",
                "args": [
                    [
                        "Symfony\\Component\\Console\\Input\\ArgvInput"
                    ],
                    [
                        "Symfony\\Component\\Console\\Output\\ConsoleOutput"
                    ]
                ]
            },
            {
                "file": "/server/websites/nextcloud/releases/nextcloud-25.0.4/console.php",
                "line": 100,
                "function": "run",
                "class": "OC\\Console\\Application",
                "type": "->",
                "args": []
            },
            {
                "file": "/server/websites/nextcloud/releases/nextcloud-25.0.4/occ",
                "line": 11,
                "args": [
                    "/server/websites/nextcloud/releases/nextcloud-25.0.4/console.php"
                ],
                "function": "require_once"
            }
        ],
        "File": "/server/websites/nextcloud/releases/nextcloud-25.0.4/lib/private/Log/ErrorHandler.php",
        "Line": 92,
        "CustomMessage": "--"
    }
}
```

**Comment by KDederichs** [comment]
Still a thing in 25.0.7 and 26.0.2

**Comment by joshtrichards** [comment]
I think there are two problems here, both upstream based on my review of upstream code (php-src):

### 1. `dns_get_record():` A temporary server error occurred.

Despite the [original report of this bug in php](https://bugs.php.net/bug.php?id=73149), in my testing `dns_get_record()` always returns `false` when expected. It just _also_ tries to provide a clue for the reason by translating the underlying `h_errno` here and outputting it *sometimes*: 

https://github.com/php/php-src/blob/15bdc85e005e4e750428b8a9f7d6460dc126c4ff/ext/standard/dns.c#L958-L981

This is in contrast to, say, `dns_check_record()`, which doesn't bother trying to provide a hint as to the reason: https://github.com/php/php-src/blob/15bdc85e005e4e750428b8a9f7d6460dc126c4ff/ext/standard/dns.c#L426-L431

### 2. Inconsistent `h_errno` state

There also seems to be some other underlying situation that - even though it returns false in both cases - the same query can trigger a `h_errno` that translates to the `TRY_AGAIN` but other times doesn't. I have one repeatable way of triggering this situation: do a `dns_get_record("bogusdomain.tld)` on an NXDOMAIN then do an `nslookup bogusdomain.tld` before calling (i.e. in between) `dns_get_record("bogusdomain.tld")` again. `false` is still returned but the `TRY_AGAIN` output goes away. Also, at this point, any further `dns_get_record("bogusdomain.tld")` will simply return `false` as expected without any `TRY_AGAIN`. You have to pick a new bogus domain to repeat the same pattern again. 

I assume what's actually happening is that this part of the case statement is being (properly?) triggered once the nslookup populates a cache somewhere or something on the localhost:

https://github.com/php/php-src/blob/15bdc85e005e4e750428b8a9f7d6460dc126c4ff/ext/standard/dns.c#L964C10-L966

On the upside, while the output is noisy and the errno *seems* inconsistent (and I can't explain exactly why that is at the moment), the actual true/false return seems accurate (i.e. non-existent hostnames and other DNS lookup failures do actually return false).

## Comparison: `dns_check_record("bogusdomain.tld","ANY") behavior

Appears to work as I'd expect with a caveat: it doesn't bother with trying to track the `h_errno` let alone provide a hint to the caller about it. It may just be suffering from the second issue above in silence (or not at all) since it otherwise looks up DNS records in basically the same manner internally as `dns_get_record()`:

https://github.com/php/php-src/blob/15bdc85e005e4e750428b8a9f7d6460dc126c4ff/ext/standard/dns.c#L426-L431

If it's not suffering from the second issue it could provide a clue as to the underlying issue here. But that's an upstream matter. Not an NC one.

The logged message may turn out to be a red herring... or not. We just care about the big picture: is the true or false an accurate indicator of DNS lookup success and failure? Yes, seems so.

We just have to deal with the noise... But also do so in a way that *will* still catch any other potential remaining oddities with DNS lookup failures that *could* still exist...

# Possible Solution

Besides some upstream matters, a path to resolution for NC at the moment turns out to be quite simple:

Call `dns_check_record(hostname, "ANY"|type)` first then if - only if - it returns `true` bother to call `dns_get_record(hostname,"DNS_ANY"|type)`. Since we only call the latter if the former succeeds - and there will by definition then be a nearby resolver with the records cached if the hostname does actually turn out to exist - it's negligible overhead. And it guarantees we won't call the noisy `dns_get_record()` since that noise only comes out when the hostname doesn't exist or there's some other DNS lookup failure.

That's my evening brain dump on this issue.

**Comment by joshtrichards** [comment]
My gut is telling me the the inconsistent errno may be a red herring in the end, but I haven't dug into what would account for the errno changing in between calls. Possibly some DNS resolver caching/etc. where in one case it isn't certain it's more than a temporary failure and in another situation it's able to conclude "nah this really doesn't exist".

Clarification about how I'm able to consistently reproduce the behavior: The "A temporary server error occurred" message goes away when I do an nslookup in between on the same non-existent domain. If I don't, it continues. And to repeat the same behavior (i.e. the noisy output) you have to pick a *new* non-existent domain once you've gone through the dns_get_record/nslookup/dns_get_record sequence each time.

Upstream (PHP): I've also added [a (briefer) comment](https://bugs.php.net/bug.php?id=73149) on the upstream bug report.

**Comment by AxIauk** [comment]
> > Is this still happening?
> 
> 362 entries in the last 8 days

This question has been around for a long time. Suddenly the source of the problem was discovered. Can be reproduced.
Confirmed that my openwrt router plugin broke DNS reverse lookup.

The router's "Reverse DNS Lookup Timeout" can use the network normally and is not easily noticed.

**Comment by AxIauk** [comment]
> My gut is telling me the the inconsistent errno may be a red herring in the end, but I haven't dug into what would account for the errno changing in between calls. Possibly some DNS resolver caching/etc. where in one case it isn't certain it's more than a temporary failure and in another situation it's able to conclude "nah this really doesn't exist". It would be a bigger deal if we weren't getting false back from dns_get_record when expected...
> 
> Clarification about how I'm able to consistently reproduce the behavior: The "A temporary server error occurred" message goes away when I do an nslookup in between on the same non-existent domain. If I don't, it continues. And to repeat the same behavior (i.e. the noisy output) you have to pick a _new_ non-existent domain once you've gone through the dns_get_record/nslookup/dns_get_record sequence each time.
> 
> Upstream (PHP): I've also added [a (briefer) comment](https://bugs.php.net/bug.php?id=73149) on the upstream bug report.

Guess: nextcloud and php, the system acquires and verifies the validity of the remote host's IP address by performing a double DNS lookup.

1. You can "double DNS lookup" on a good server,
2. Close reverse DNS (PTR) lookup.
3. debian11's ping (double DNS lookup) domain name times out.
ping -n (followed by a forward DNS (A)) domain name is normal,
4. Nextcloud log gets dns_get_record() error.

**Comment by MrRinkana** [comment]
I'm getting these errors occassinaly on 28.0.5 aswell. Typically look like this:

```json
{
  "reqId": "uAUQFEwikg5QBkd5s9AK",
  "level": 3,
  "time": "2024-04-26T01:57:20+00:00",
  "remoteAddr": "",
  "user": "--",
  "app": "PHP",
  "method": "",
  "url": "--",
  "message": "dns_get_record(): A temporary server error occurred. at /srv/www/nextcloud/lib/private/Http/Client/DnsPinMiddleware.php#111",
  "userAgent": "--",
  "version": "28.0.5.1",
  "data": {
    "app": "PHP"
  },
  "id": "6638a4774308c"
}
```
It does not happen often, only once since update to 28.0.5 but they always come in a bunch (8 last time). Last time they also where followed by a warning:


<details>
<summary>"LocalServerException No DNS record found for apps.nextcloud.com" which details:</summary>

```
{
  "reqId": "uAUQFEwikg5QBkd5s9AK",
  "level": 2,
  "time": "2024-04-26T01:57:32+00:00",
  "remoteAddr": "",
  "user": "--",
  "app": "appstoreFetcher",
  "method": "",
  "url": "--",
  "message": "No DNS record found for apps.nextcloud.com",
  "userAgent": "--",
  "version": "28.0.5.1",
  "exception": {
    "Exception": "OCP\\Http\\Client\\LocalServerException",
    "Message": "No DNS record found for apps.nextcloud.com",
    "Code": 0,
    "Trace": [
      {
        "file": "/srv/www/nextcloud/3rdparty/guzzlehttp/guzzle/src/PrepareBodyMiddleware.php",
        "line": 35,
        "function": "OC\\Http\\Client\\{closure}",
        "class": "OC\\Http\\Client\\DnsPinMiddleware",
        "type": "->",
        "args": [
          "*** sensitive parameters replaced ***"
        ]
      },
      {
        "file": "/srv/www/nextcloud/3rdparty/guzzlehttp/guzzle/src/Middleware.php",
        "line": 31,
        "function": "__invoke",
        "class": "GuzzleHttp\\PrepareBodyMiddleware",
        "type": "->"
      },
      {
        "file": "/srv/www/nextcloud/3rdparty/guzzlehttp/guzzle/src/RedirectMiddleware.php",
        "line": 71,
        "function": "GuzzleHttp\\{closure}",
        "class": "GuzzleHttp\\Middleware",
        "type": "::",
        "args": [
          "*** sensitive parameters replaced ***"
        ]
      },
      {
        "file": "/srv/www/nextcloud/3rdparty/guzzlehttp/guzzle/src/Middleware.php",
        "line": 63,
        "function": "__invoke",
        "class": "GuzzleHttp\\RedirectMiddleware",
        "type": "->"
      },
      {
        "file": "/srv/www/nextcloud/3rdparty/guzzlehttp/guzzle/src/HandlerStack.php",
        "line": 75,
        "function": "GuzzleHttp\\{closure}",
        "class": "GuzzleHttp\\Middleware",
        "type": "::",
        "args": [
          "*** sensitive parameters replaced ***"
        ]
      },
      {
        "file": "/srv/www/nextcloud/3rdparty/guzzlehttp/guzzle/src/Client.php",
        "line": 331,
        "function": "__invoke",
        "class": "GuzzleHttp\\HandlerStack",
        "type": "->"
      },
      {
        "file": "/srv/www/nextcloud/3rdparty/guzzlehttp/guzzle/src/Client.php",
        "line": 168,
        "function": "transfer",
        "class": "GuzzleHttp\\Client",
        "type": "->"
      },
      {
        "file": "/srv/www/nextcloud/3rdparty/guzzlehttp/guzzle/src/Client.php",
        "line": 187,
        "function": "requestAsync",
        "class": "GuzzleHttp\\Client",
        "type": "->",
        "args": [
          "*** sensitive parameters replaced ***"
        ]
      },
      {
        "file": "/srv/www/nextcloud/lib/private/Http/Client/Client.php",
        "line": 230,
        "function": "request",
        "class": "GuzzleHttp\\Client",
        "type": "->"
      },
      {
        "file": "/srv/www/nextcloud/lib/private/App/AppStore/Fetcher/Fetcher.php",
        "line": 124,
        "function": "get",
        "class": "OC\\Http\\Client\\Client",
        "type": "->"
      },
      {
        "file": "/srv/www/nextcloud/lib/private/App/AppStore/Fetcher/AppFetcher.php",
        "line": 86,
        "function": "fetch",
        "class": "OC\\App\\AppStore\\Fetcher\\Fetcher",
        "type": "->"
      },
      {
        "file": "/srv/www/nextcloud/lib/private/App/AppStore/Fetcher/Fetcher.php",
        "line": 195,
        "function": "fetch",
        "class": "OC\\App\\AppStore\\Fetcher\\AppFetcher",
        "type": "->"
      },
      {
        "file": "/srv/www/nextcloud/lib/private/App/AppStore/Fetcher/AppFetcher.php",
        "line": 187,
        "function": "get",
        "class": "OC\\App\\AppStore\\Fetcher\\Fetcher",
        "type": "->"
      },
      {
        "file": "/srv/www/nextcloud/lib/private/Installer.php",
        "line": 423,
        "function": "get",
        "class": "OC\\App\\AppStore\\Fetcher\\AppFetcher",
        "type": "->"
      },
      {
        "file": "/srv/www/nextcloud/apps/updatenotification/lib/Notification/BackgroundJob.php",
        "line": 252,
        "function": "isUpdateAvailable",
        "class": "OC\\Installer",
        "type": "->"
      },
      {
        "file": "/srv/www/nextcloud/apps/updatenotification/lib/Notification/BackgroundJob.php",
        "line": 150,
        "function": "isUpdateAvailable",
        "class": "OCA\\UpdateNotification\\Notification\\BackgroundJob",
        "type": "->"
      },
      {
        "file": "/srv/www/nextcloud/apps/updatenotification/lib/Notification/BackgroundJob.php",
        "line": 76,
        "function": "checkAppUpdates",
        "class": "OCA\\UpdateNotification\\Notification\\BackgroundJob",
        "type": "->"
      },
      {
        "file": "/srv/www/nextcloud/lib/public/BackgroundJob/Job.php",
        "line": 81,
        "function": "run",
        "class": "OCA\\UpdateNotification\\Notification\\BackgroundJob",
        "type": "->"
      },
      {
        "file": "/srv/www/nextcloud/lib/public/BackgroundJob/TimedJob.php",
        "line": 102,
        "function": "start",
        "class": "OCP\\BackgroundJob\\Job",
        "type": "->"
      },
      {
        "file": "/srv/www/nextcloud/lib/public/BackgroundJob/TimedJob.php",
        "line": 92,
        "function": "start",
        "class": "OCP\\BackgroundJob\\TimedJob",
        "type": "->"
      },
      {
        "file": "/srv/www/nextcloud/cron.php",
        "line": 152,
        "function": "execute",
        "class": "OCP\\BackgroundJob\\TimedJob",
        "type": "->"
      }
    ],
    "File": "/srv/www/nextcloud/lib/private/Http/Client/DnsPinMiddleware.php",
    "Line": 139,
    "message": "No DNS record found for apps.nextcloud.com",
    "exception": [],
    "CustomMessage": "No DNS record found for apps.nextcloud.com"
  },
  "id": "6638a4774306c"
}
```

</details>

I do not know how to trigger them, seems to happen randomly (like 4am when probably noone is using the server actively).

Let me know if you want configuration or something else!

**Comment by skl256** [comment]
### My solution:

Create _Dockerfile_ & _99-fix-dns-get-record-server-error.sh_

_Dockerfile_:
```
FROM nextcloud:27.1.9-fpm # replcace nextcloud:27.1.9-fpm to your nextcloud image
	
# Fix https://github.com/nextcloud/server/issues/34205
COPY 99-fix-dns-get-record-server-error.sh /docker-entrypoint-hooks.d/before-starting/99-fix-dns-get-record-server-error.sh
RUN chmod +x /docker-entrypoint-hooks.d/before-starting/99-fix-dns-get-record-server-error.sh
```

_99-fix-dns-get-record-server-error.sh_:
```
#! /bin/sh
sed -i 's/dnsTypes = \[DNS_A, DNS_AAAA, DNS_CNAME\];/dnsTypes = [DNS_A, DNS_AAAA];/' /var/www/html/lib/private/Http/Client/DnsPinMiddleware.php
```
Next build image and use instead of your old nextcloud image.

`docker image build -t my_fixed_nextcloud_image_name .` (don't forget the dot at the end)

**Comment by joshtrichards** [comment]
@skl256 By chance do either of the following trigger the failure in your environment:

Either running this within the app container:

`php -r 'var_dump(dns_get_record("localhost", DNS_CNAME));`

Or something like this in a dedicated (throwaway) `php` container:

`docker run -it --rm -v $(pwd):/var/www php:latest php -r "var_dump(dns_get_record('localhost', DNS_CNAME));"`

I've seen some reports around of failures when php+dns_get_record+docker+localhost+CNAME are combined. I can't reproduce it in my environments, but there are multiple reports so perhaps a buggy Docker Engine version or something.

**Comment by VitalyEmelyanov** [comment]
Same issue at 29.0.4

**Comment by Daryes** [comment]
> @skl256 By chance do either of the following trigger the failure in your environment:
> 
> Either running this within the app container:
> 
> `php -r 'var_dump(dns_get_record("localhost", DNS_CNAME));`
> 
> Or something like this in a dedicated (throwaway) `php` container:
> 
> `docker run -it --rm -v $(pwd):/var/www php:latest php -r "var_dump(dns_get_record('localhost', DNS_CNAME));"`
> 
> I've seen some reports around of failures when php+dns_get_record+docker+localhost+CNAME are combined. I can't reproduce it in my environments, but there are multiple reports so perhaps a buggy Docker Engine version or something.

I've checked in a standard installation without docker, the command you gave will also raise the same error :
```
$ php --version
PHP 8.1.27 (cli) (built: Feb 25 2024 12:02:49) (NTS)
Copyright (c) The PHP Group
Zend Engine v4.1.27, Copyright (c) Zend Technologies
    with Zend OPcache v8.1.27, Copyright (c), by Zend Technologies

$ php -r 'var_dump(dns_get_record("localhost", DNS_CNAME));'
PHP Warning:  dns_get_record(): A temporary server error occurred. in Command line code on line 1
bool(false)
```

Btw, asking to search a CNAME for `localhost` is bound to raise an error :   
this is a executed as a real DNS query, you'll not get an answer for such record from a server which is not running even a cache dns server, like dsnmasq.

**Comment by skl256** [comment]
@joshtrichards 

Hm..

run `docker container run --dns 192.168.2.1 --network host -it --rm php php -r "var_dump(dns_get_record('localhost', DNS_CNAME));"`
result `Warning: dns_get_record(): A temporary server error occurred. in Command line code on line 1
bool(false)`

but

run `docker container run --dns 192.168.0.1 --network host -it --rm php php -r "var_dump(dns_get_record('localhost', DNS_CNAME));"`
result `array(0) {}`

At the same time, the DNS server on the router 192.168.2.1 is set to 192.168.0.1
Well, in general, it is already clear that this is not a problem with NextCloud.

**Comment by Daryes** [comment]
@skl256 
your test changing the dns server gave me an idea : I have different DNS servers, including Bind and Windows NS

So, with a little  dusting on tcpdump, and changing the /etc/resolv.conf file of the webserver

1. Default resolv configuration => 2 * Windows 2019 with DNS service as resolver
```
$ sudo tcpdump "port 53"
tcpdump: verbose output suppressed, use -v[v]... for full protocol decode
listening on ens32, link-type EN10MB (Ethernet), snapshot length 262144 bytes
21:46:22.427534 IP webserver.corp.tld.34042 > winsrv-1.corp.tld.domain: 19285+ CNAME? localhost.corp.tld. (40)
21:46:22.428458 IP winsrv-1.corp.tld.domain > webserver.corp.tld.34042: 19285 NXDomain* 0/1/0 (110)
21:46:22.428614 IP webserver.corp.tld.58833 > winsrv-1.corp.tld.domain: 52092+ CNAME? localhost. (27)
21:46:22.429037 IP winsrv-1.corp.tld.domain > webserver.corp.tld.58833: 52092 ServFail 0/0/0 (27)
21:46:22.429206 IP webserver.corp.tld.34134 > winsrv-2.corp.tld.domain: 52092+ CNAME? localhost. (27)
21:46:22.430426 IP winsrv-2.corp.tld.domain > webserver.corp.tld.34134: 52092 ServFail 0/0/0 (27)
21:46:22.430580 IP webserver.corp.tld.57252 > winsrv-1.corp.tld.domain: 52092+ CNAME? localhost. (27)
21:46:22.431023 IP winsrv-1.corp.tld.domain > webserver.corp.tld.57252: 52092 ServFail 0/0/0 (27)
21:46:22.431162 IP webserver.corp.tld.35109 > winsrv-2.corp.tld.domain: 52092+ CNAME? localhost. (27)
21:46:22.432043 IP winsrv-2.corp.tld.domain > webserver.corp.tld.35109: 52092 ServFail 0/0/0 (27)
```

2. Altered resolv configuration => 1 * home router with dnsmask as resolver (not really sure)
```
$ sudo tcpdump "port 53"
tcpdump: verbose output suppressed, use -v[v]... for full protocol decode
listening on ens32, link-type EN10MB (Ethernet), snapshot length 262144 bytes
21:47:32.238120 IP 192.168.0.222.34233 > 192.168.0.1.domain: 41476+ CNAME? localhost.corp.tld. (40)
21:47:32.251614 IP 192.168.0.1.domain > 192.168.0.222.34233: 41476 NXDomain* 0/0/0 (40)
21:47:32.251808 IP 192.168.0.222.45499 > 192.168.0.1.domain: 54483+ CNAME? localhost. (27)
21:47:32.266222 IP 192.168.0.1.domain > 192.168.0.222.45499: 54483 NXDomain 0/1/0 (102)
```

3. Altered resolv configuration => 1 * Ubuntu with Bind 9 as resolver
```
$ sudo tcpdump "port 53"
tcpdump: verbose output suppressed, use -v[v]... for full protocol decode
listening on ens32, link-type EN10MB (Ethernet), snapshot length 262144 bytes
21:49:29.921220 IP 192.168.0.222.49938 > 192.168.0.200.domain: 46746+ CNAME? localhost.corp.tld. (40)
21:49:29.921579 IP 192.168.0.200.domain > 192.168.0.222.49938: 46746 NXDomain* 0/1/0 (95)
21:49:29.921683 IP 192.168.0.222.51571 > 192.168.0.200.domain: 6416+ CNAME? localhost. (27)
21:49:29.921948 IP 192.168.0.200.domain > 192.168.0.222.51571: 6416* 0/1/0 (68)
```

All will answer NXDomain to a `localhost.domain.tld` query, which is somewhat expected. 
But for a `localhost.` query, Windows will answer with ServFail (which explains the retries from the client to both servers), dnsmasq answer with NXDomain, and Bind with nothing.

Knowing what to look for, according to the [RFC 1912](https://www.ietf.org/rfc/rfc1912.txt) => 4.1 :
>    The "localhost" address is a "special" address which always refers to
>    the local host.  It should contain the following line:
>            localhost.      IN      A       127.0.0.1
> 
>    The "127.0" file should contain the line:
>            1    PTR     localhost.
> 
>    There has been some extensive discussion about whether or not to
>    append the local domain to it.  The conclusion is that "localhost."
>    would be the best solution. 

There are other discussions about this, like on Stackoverflow.
The major problem is there are no obligation for this zone : **should** is used, and not **must**
Which might occur with other DNS resolvers.

Btw, it seems the php implementation is also not valid, an error should be raised when an empty answer is given.


@joshtrichards 
If I'm not mistaken in my findings, it seems while the root cause is not NextCloud, it will fall to it to have a working solution.
And to be honest, I didn't know about this, as I would never have the idea to allow a remote query for the localhost record.

**Comment by come-nc** [comment]
@Daryes Does that mean adding some manual handling for `localhost` in `DnsPinMiddleware` would fix it? Could you try?

**Comment by Daryes** [comment]
It seems a custom handler for localhost is doing the job, the log went silent when I plugged this in :
```
$ diff -u4 lib/private/Http/Client/DnsPinMiddleware.php.org  lib/private/Http/Client/DnsPinMiddleware.php
--- lib/private/Http/Client/DnsPinMiddleware.php.org    2024-06-25 12:10:58.000000000 +0200
+++ lib/private/Http/Client/DnsPinMiddleware.php        2024-08-20 00:19:36.769965898 +0200
@@ -64,9 +64,10 @@
                return reset($responses);
        }

        private function dnsResolve(string $target, int $recursionCount) : array {
-               if ($recursionCount >= 10) {
+               // max 9 dns recusions - localhost has no dns record to retrieve
+               if ($recursionCount >= 10 || $target == "localhost") {
                        return [];
                }

                $recursionCount++;
```
I'm waiting some more days to confirm, still

**Comment by come-nc** [comment]
Is an empty answer the correct answer for localhost?
Can you create a pull request for this if it fixes the problem?

**Comment by Daryes** [comment]
@come-nc 
While it reduce drastically the flood, it does not fix it : 
![nextcloud-dns](https://github.com/user-attachments/assets/4a169c55-3ad9-485d-ac18-c0a2cd21acac)

This time, those are from dnsGetRecord(), a wrapper for dns_get_record()

As there are different dns functions, while a manual handling of some reserved name, starting with "localhost" might do the trick, it seems knowledge of nextwork working is required.
As you asked, I have no way of knowing if an empty answer is the correct way for a localhost query.
I based it about the fact nextcloud do not complains when the dns query returns empty without an error code. 
I am not a php dev, less a Nextcloud dev.
I can use my environment to validate a fix, still

**Comment by evrim706** [comment]
is this fixed yet? im having the same problem

**Comment by VitalyEmelyanov** [comment]
Still an issue at 29.0.7

`dns_get_record(): A temporary server error occurred. at /var/www/html/lib/private/Http/Client/DnsPinMiddleware.php#113`

**Comment by MrRinkana** [comment]
Maybe everyone who is still getting these errors could edit their comments to add what OS/environment they are running? And according to above comment if they have libnss-resolve installed?

**Comment by VitalyEmelyanov** [comment]
I’m using an official docker fpm alpine image

**Comment by Daryes** [comment]
> Maybe everyone who is still getting these errors could edit their comments to add what OS/environment they are running? And according to above comment if they have libnss-resolve installed?

Ubuntu 22.04, installed from the official ISO image, libnss-resolve is not installed
```
$ grep '^hosts:' /etc/nsswitch.conf
hosts:          files dns
```
so the default config, nothing related to the linked issue in systemd repo, which seems limited to cloud images.


Btw, I already gave an explanation about why this occurs : https://github.com/nextcloud/server/issues/34205#issuecomment-2295423048
Given the tcpdump results, it seems related to the way each DNS server/resolver handle a dns query for `localhost.`
* Windows Server will answer with ServFail
* dnsmask (looks like) will answer with NXDomain
* Bind/named will answer with ""

(the . at the end of localhost is not an error, all dns clients will add this, to be able to search on different domain suffixes, stated by the "search" parameter in resolv.conf, even if empty) 

And you can expect many company using Active Directory for managing user accounts, which make it Windows DNS Server mandatory.

To fix this, having "localhost" a special case returning immediately an empty answer seems working, instead of passing to the php function `dns_get_record()`
the main problem is there are not only one, but at least 2 functions wrapping `dns_get_record()` in nextcloud, if not more.
_And I am myself wondering why in the first case localhost had to be queried on dns resolvers._

**Comment by FaBMak** [comment]
Still an issue at 32.0.1.

The problem apparently is dns_get_record getting ANY record. Since, most of the DNS Servers won't responding it, anymore.
https://dustri.org/b/a-short-tale-on-phps-dns_get_record.html

My fix was moving the DNS Server, from Cloudflare do Quad9. Because, they still serving ANY queries.
